{
  "$schema": "https://json-schema.org/draft/2020-12/schema",
  "$id": "https://jaldrishti.org/schemas/sources.schema.json",
  "title": "IKSSourceTraceability",
  "description": "Schema enforcing academic and research traceability for all IKS and conservation assertions.",
  "type": "array",
  "items": {
    "type": "object",
    "required": [
      "source_id",
      "title",
      "publisher",
      "year",
      "url",
      "topic"
    ],
    "properties": {
      "source_id": {
        "type": "string",
        "description": "Unique identifier e.g. SRC_ASI_CONSERVATION_MANUAL_2020"
      },
      "title": {
        "type": "string"
      },
      "publisher": {
        "type": "string"
      },
      "year": {
        "type": ["integer", "string"]
      },
      "url": {
        "type": "string"
      },
      "topic": {
        "type": "string"
      },
      "author": {
        "type": "string",
        "description": "Primary author, editor, technical committee, or issuing institution"
      },
      "evidence_type": {
        "type": "string",
        "enum": [
          "documented_historical_practice",
          "traditional_knowledge_recorded",
          "modern_conservation_guidance",
          "experimental_findings",
          "unverified_claim_hypothesis"
        ],
        "description": "Methodological basis of the source evidence"
      },
      "historical_period": {
        "type": "string",
        "description": "Historical epoch or modern statutory era"
      },
      "relevant_region": {
        "type": "string",
        "description": "Geographical or geological region to which the evidence applies"
      },
      "applicable_structure_types": {
        "type": "array",
        "items": {
          "type": "string"
        },
        "description": "Heritage water structure typologies validated by this source"
      },
      "confidence_limitations": {
        "type": "string",
        "description": "Scientific limitations, uncertainties, or boundary assumptions of the source"
      },
      "practical_conservation_relevance": {
        "type": "string",
        "description": "Direct application of this source to on-site conservation engineering"
      },
      "non_generalizable_conditions": {
        "type": "array",
        "items": {
          "type": "string"
        },
        "description": "Conditions or environments under which claims from this source must NOT be generalized"
      },
      "expert_verification_status": {
        "type": "string",
        "enum": [
          "verified_authoritative",
          "provisional_guidance",
          "needs_field_validation"
        ],
        "description": "Conservation domain review and verification status"
      },
      "claim_supported": {
        "type": "string",
        "description": "Specific conservation principle or material rule substantiated by this source"
      },
      "claims_supported": {
        "type": "array",
        "items": {
          "type": "string"
        },
        "description": "List of specific conservation, engineering, or hydrological claims substantiated by this source"
      }
    }
  }
}
