[
  {
    "source_id": "SRC_ASI_CONSERVATION_MANUAL_2020",
    "title": "Architectural Conservation: Principles and Practice in India",
    "author": "Archaeological Survey of India (ASI) & INTACH",
    "publisher": "Archaeological Survey of India / INTACH",
    "year": 2020,
    "url": "https://intach.org/conservation-guidelines.php",
    "topic": "Lime mortar compatibility, stone masonry conservation, and non-destructive intervention",
    "evidence_type": "modern_conservation_guidance",
    "historical_period": "Modern statutory guidance (2020 revision)",
    "relevant_region": "Pan-Indian / Subcontinental Heritage",
    "applicable_structure_types": [
      "baoli",
      "bawari",
      "kund",
      "vav",
      "tank"
    ],
    "confidence_limitations": "National guidelines establish authoritative policy standards and ethical boundaries, but do not replace site-specific petrographic, XRD, and moisture testing on historic stone/mortar samples.",
    "practical_conservation_relevance": "Provides regulatory basis for prohibiting Ordinary Portland Cement (OPC) on historic lime masonry; mandates sacrificial breathability and minimum intervention.",
    "non_generalizable_conditions": [
      "Not applicable to mid-20th-century reinforced concrete heritage structures.",
      "Cannot be applied without adjusting binder-aggregate ratios to local quarry stones."
    ],
    "expert_verification_status": "verified_authoritative",
    "claim_supported": "Use of Ordinary Portland Cement (OPC) on historic lime mortar masonry causes moisture entrapment, salt crystallization, and accelerated stone spalling.",
    "claims_supported": [
      "Use of Ordinary Portland Cement (OPC) on historic lime mortar masonry causes moisture entrapment, salt crystallization, and accelerated stone spalling.",
      "Traditional lime mortars provide essential breathability and ductile stress accommodation for historic stone masonry.",
      "Intervention materials must possess lower compressive strength and higher vapor permeability than historic substrate stones."
    ]
  },
  {
    "source_id": "SRC_INTACH_CHARTER_2004",
    "title": "INTACH Charter for the Conservation of Unprotected Architectural Heritage and Sites in India",
    "author": "Indian National Trust for Art and Cultural Heritage (INTACH)",
    "publisher": "Indian National Trust for Art and Cultural Heritage (INTACH)",
    "year": 2004,
    "url": "http://intach.org/pdf/charter.pdf",
    "topic": "Indigenous master-builder traditions, vernacular craftsmanship, and minimum intervention ethics",
    "evidence_type": "modern_conservation_guidance",
    "historical_period": "Modern conservation charter (adopted 2004)",
    "relevant_region": "Pan-Indian (special focus on vernacular and unprotected community water heritage)",
    "applicable_structure_types": [
      "baoli",
      "bawari",
      "kund",
      "vav",
      "tank"
    ],
    "confidence_limitations": "Ethical and procedural charter; does not provide quantitative structural equations, finite element thresholds, or laboratory testing procedures.",
    "practical_conservation_relevance": "Affirms the priority of local traditional craftsmanship (e.g., Sompura, Chettiar, or local mistri guilds) and indigenous material systems over industrialized replacements.",
    "non_generalizable_conditions": [
      "Guidelines do not supersede statutory safety evacuations when active structural collapse is imminent.",
      "Traditional building knowledge must be verified for the specific regional geology before application."
    ],
    "expert_verification_status": "verified_authoritative",
    "claim_supported": "Preservation of indigenous craftsmanship traditions and traditional material systems takes precedence over modern industrial replacements.",
    "claims_supported": [
      "Preservation of indigenous craftsmanship traditions and traditional material systems takes precedence over modern industrial replacements.",
      "Living heritage water structures require maintenance of traditional community stewardship and functional water catchment systems.",
      "Interventions should adhere to the principle of minimum intervention to retain authentic historic fabric."
    ]
  },
  {
    "source_id": "SRC_LIVINGSTON_2002",
    "title": "Steps to Water: The Ancient Stepwells of India",
    "author": "Morna Livingston",
    "publisher": "Princeton Architectural Press",
    "year": 2002,
    "url": "https://www.papress.com",
    "topic": "Stepwell typological evolution, subterranean microclimates, and stepped hydraulic access",
    "evidence_type": "traditional_knowledge_recorded",
    "historical_period": "7th Century CE to 19th Century CE",
    "relevant_region": "Western and Northern India (Gujarat, Rajasthan, Delhi, Madhya Pradesh)",
    "applicable_structure_types": [
      "baoli",
      "bawari",
      "vav"
    ],
    "confidence_limitations": "Architectural and spatial documentation based on field surveys; lacks destructive core testing, chemical binder assays, and geotechnical pore-water calculations.",
    "practical_conservation_relevance": "Documents functional geometries of descending multi-tier galleries, structural pavilion cross-struts (kutas), and passive subterranean thermal buffering.",
    "non_generalizable_conditions": [
      "Architectural configurations documented in semi-arid alluvial plains cannot be generalized to rock-cut plateau cisterns or wet tropical stepped tanks.",
      "Assumptions regarding historical groundwater levels reflect pre-industrial water tables and must be recalibrated against modern over-extracted aquifer depths."
    ],
    "expert_verification_status": "verified_authoritative",
    "claim_supported": "Stepped geometry enables direct, safe pedestrian descent to fluctuating seasonal groundwater levels across 10 to 25 meter ranges.",
    "claims_supported": [
      "Stepped geometry enables direct, safe pedestrian descent to fluctuating seasonal groundwater levels across 10 to 25 meter ranges.",
      "Subterranean tiered pavilions provide thermal dampening, keeping ambient temperatures substantially below exterior desert heat.",
      "Multi-level cross-beams and lintels serve structural roles as horizontal struts resisting inward active earth pressure on retaining walls."
    ]
  },
  {
    "source_id": "SRC_JAIN_NEUBAUER_1981",
    "title": "The Stepwells of Gujarat: In Art-Historical Perspective",
    "author": "Jutta Jain-Neubauer",
    "publisher": "Abhinav Publications",
    "year": 1981,
    "url": "https://archive.org/details/stepwellsofgujar0000jain",
    "topic": "Vav subterranean architectural morphology, structural pavilions (kutas), and hydraulic design",
    "evidence_type": "documented_historical_practice",
    "historical_period": "Solanki / Chaulukya to Sultanate periods (10th to 16th Century CE)",
    "relevant_region": "Gujarat (Patan, Adalaj, Ahmedabad, Viramgam)",
    "applicable_structure_types": [
      "vav"
    ],
    "confidence_limitations": "Primarily an art-historical and typological treatise; does not provide structural failure criteria, petrographic classifications, or hydraulic runoff modelling.",
    "practical_conservation_relevance": "Identifies the structural mechanics of kutas (multi-storey pillared pavilions) acting as retaining struts that counterbalance lateral soil thrust on long stepped corridors.",
    "non_generalizable_conditions": [
      "Findings apply specifically to Gujarat vav typologies in alluvial soils; they cannot be generalized to basalt-rubble kunds of the Deccan Traps.",
      "Orientation rules documented in historical texts represent ideal treatises (Vastu/Shilpa Shastras) and may vary based on local site topography."
    ],
    "expert_verification_status": "verified_authoritative",
    "claim_supported": "The structural layout of Gujarat vavs incorporates multi-tiered pavilions (kutas) that counterbalance lateral soil thrust on stepped corridors.",
    "claims_supported": [
      "The structural layout of Gujarat vavs incorporates multi-tiered pavilions (kutas) that counterbalance lateral soil thrust on stepped corridors.",
      "Subterranean orientation along East-West axes reduces direct solar thermal load inside stepped wells.",
      "Separation between public stepped descending galleries and vertical circular well shafts maintains sanitary abstraction."
    ]
  },
  {
    "source_id": "SRC_CSE_DYING_WISDOM_1997",
    "title": "Dying Wisdom: Rise, Fall and Potential of India's Traditional Water Harvesting Systems",
    "author": "Anil Agarwal and Sunita Narain (Eds.)",
    "publisher": "Centre for Science and Environment (CSE), New Delhi",
    "year": 1997,
    "url": "https://www.cseindia.org/dying-wisdom-470",
    "topic": "Traditional water harvesting typologies: Baoli, Bawari, Kund, Johad, and micro-catchment ecology",
    "evidence_type": "traditional_knowledge_recorded",
    "historical_period": "Traditional indigenous practices (Antiquity to 20th Century)",
    "relevant_region": "Pan-Indian (Thar Desert, Central Highlands, Deccan, Indo-Gangetic Plains)",
    "applicable_structure_types": [
      "baoli",
      "bawari",
      "kund",
      "tank"
    ],
    "confidence_limitations": "Comprehensive socio-ecological and technical field survey; hydrological discharge figures and recharge estimates are representative rather than instrumented telemetry data.",
    "practical_conservation_relevance": "Demonstrates the necessity of conserving the complete hydrological ecosystem (catchment apron, feeder channels, silt traps) rather than treating the monument as an isolated architectural shell.",
    "non_generalizable_conditions": [
      "Catchment revival recommendations assume available surrounding open catchment; severely encroached dense urban environments require engineered diversion retrofits.",